Unnamed: 0,timestamp,sender,messages,sentiment_per_chat,sentiment_per_sesi,session_index,file_index,preprocessed,unique_index
115,18/12/20,dosen,"Baik [MHS], berikut review dari saya  .. Setelah dihitung nilai fleiss kappa nya, didapatkan hasil sebagai berikut query1: 76% query2: 43% query3: 27% query4: 45% query5: 84%  Berdasarkan patokan yang digunakan pada bab 2, nilai kappa yang baik diatas 60% Sebaiknya bagaimana ya pak untuk ground truth nya? Apakah tetap digunakan saja atau harus dilabeli ulang?  --> Saya sarankan cukup dengan mengurangi Querynya yaitu dgn menghapus ""Query 3"" atau menghapus ""Query 2 & 3"", paling tidak rata nilai kappnya masih diatas 60.  Atau Mengurangi data yang berbeda keputasan antar annotator-nya  Dan juga berhubung kendala pada ground truth ini dan juga jadwal dosen pembimbing 2 hari ini penuh, saya tidak yakin bisa progress p2 ke dosen pembimbing 2 hari ini. Apakah tidak apa-apa jika pelaksanaan p2 kepada pembimbing 2 lewat batas hari ini?  --> tidak apa"", kuncinya adalah P2 tepat waktu oleh dosbing ke-1, utk ke dosbing ke-2 bisa lewat batas. ",1,1.0,30,3,"['mahasiswa', 'ulas', 'hitung', 'nilai', 'fleiss', 'kappa', 'nya', 'hasil', 'query1', '76', 'query2', '43', 'query3', '27', 'query4', '45', 'query5', '84', 'dasar', 'patok', 'bab', '2', 'nilai', 'kappa', '60', 'iya', 'ground', 'truth', 'nya', 'label', 'ulang', '--', 'saran', 'querynya', 'hapus', 'kueri', '3', 'hapus', 'kueri', '2', '3', 'nilai', 'kappnya', '60', 'data', 'beda', 'keputasan', 'annotator-nya', 'hubung', 'kendala', 'ground', 'truth', 'jadwal', 'dosen', 'bimbing', '2', 'penuh', 'progres', 'p2', 'dosen', 'bimbing', '2', 'laksana', 'p2', 'bimbing', '2', 'batas', '--', 'kunci', 'p2', 'dosen pembimbing', 'ke-1', 'dosen pembimbing', 'ke-2', 'batas']",30_3
116,18/12/20,mahasiswa,"Baik pak, terima kasih atas reviewnya. ",1,1.0,30,3,"['terima', 'kasih', 'reviewnya']",30_3
175,11/1/21,mahasiswa,"Selamat sore pak. Mohon maaf mengganggu. Saya [MHS] salah satu mahasiswa bimbingan skripsi Bapak.  Saya ingin memberi kabar bahwa nilai saya sudah diinputkan semua kemarin hari Minggu dan tadi pagi saya sudah mengajukan transkrip nilai saya ke kaprodi dan sudah ditandatangan sore ini. Sekarang saya sudah mengirimkan transkrip tersebut ke akademik prodi untuk penjadwalan ujian skripsi. Namun saya masih belum tahu kepastian apakah memang sempat terjadwalkan ujian semester ini.  Sekian yang ingin saya sampaikan. Jika ada salah kata, saya mohon maaf.  Salam. [MHS] ",1,1.0,34,3,"['selamat', 'sore', 'mohon', 'maaf', 'ganggu', 'mahasiswa', 'salah', 'mahasiswa', 'bimbing', 'skripsi', 'kabar', 'nilai', 'diinputkan', 'kemarin', 'minggu', 'pagi', 'aju', 'transkrip', 'nilai', 'kaprodi', 'ditandatangan', 'sore', 'kirim', 'transkrip', 'akademik', 'prodi', 'jadwal', 'uji', 'skripsi', 'jadwal', 'uji', 'semester', 'sekian', 'salah', 'mohon', 'maaf', 'salam', 'mahasiswa']",34_3
176,11/1/21,dosen,"Baik [MHS], mudah-mudahan akademik segera bisa menjadwalkan antara tgl 12/13 Januari 2021, sesuai dengan yang tertera di FIlkom App. Aamiin. ",1,1.0,34,3,"['mahasiswa', 'mudah', 'akademik', 'jadwal', 'tanggal', '12', '13', 'januari', '2021', 'sesuai', 'tera', 'filkom', 'app', 'aamiin']",34_3
177,11/1/21,dosen,<DOC>,1,1.0,34,3,['doc'],34_3
178,11/1/21,dosen,"Usahakan besok siang coba ditanyakan ke akademik terkait hal tersebut, lalu sampaikan hasilnya ke saya, jika ada kendala, saya akan coba bantu menghubungi akademik. ",1,1.0,34,3,"['usaha', 'besok', 'siang', 'coba', 'akademik', 'kait', 'hasil', 'kendala', 'coba', 'bantu', 'hubung', 'akademik']",34_3
179,11/1/21,mahasiswa,"Baik pak, akan saya kabarkan lagi perkembangannya besok. Terima kasih banyak atas perhatiannya. ",1,1.0,34,3,"['kabar', 'kembang', 'besok', 'terima', 'kasih', 'perhati']",34_3
180,12/1/21,mahasiswa,"Selamat pagi pak. Mohon maaf mengganggu. Saya [MHS] salah satu mahasiswa bimbingan Bapak.  Saya ingin memberi kabar bahwa ujian skripsi saya sudah terjadwal dan sedang pada proses pembuatan surat undangan. Ujian skripsi saya akan diadakan pada hari Rabu tanggal 13 Januari 2021 pukul 10.30 WIB. Untuk surat undangan akan saya berikan kepada Bapak setelah undangan diterbitkan.  Sekian yang ingin saya sampaikan. Terima kasih atas perhatian Bapak. Jika ada salah kata, saya mohon maaf.  Salam, [MHS] ",1,1.0,35,3,"['selamat', 'pagi', 'mohon', 'maaf', 'ganggu', 'mahasiswa', 'salah', 'mahasiswa', 'bimbing', 'kabar', 'uji', 'skripsi', 'jadwal', 'proses', 'surat', 'undang', 'uji', 'skripsi', 'rabu', 'tanggal', '13', 'januari', '2021', '10', '30', 'wib', 'surat', 'undang', 'ikan', 'undang', 'terbit', 'sekian', 'terima', 'kasih', 'perhati', 'salah', 'mohon', 'maaf', 'salam', 'mahasiswa']",35_3
181,12/1/21,dosen,"Great, Baik [MHS], noted. Semoga lancar & sukses. Aamiin. ",1,1.0,35,3,"['bagus', 'mahasiswa', 'dicatat', 'moga', 'lancar', 'sukses', 'aamiin']",35_3
182,12/1/21,mahasiswa,"Amin. Baik pak, terima kasih banyak. ",1,1.0,35,3,"['amin', 'terima', 'kasih']",35_3
183,12/1/21,mahasiswa,"Selamat pagi. Mohon maaf mengganggu waktunya. Saya [MHS] selaku mahasiswa bimbingan skripsi Bapak.  Disini saya ingin mengundang bapak untuk dapat hadir pada ujian skripsi saya yang akan diadakan pada: Hari: Rabu Tanggal: 13 Januari 2021 Pukul: 10.30  Dengan bapak sebagai pembimbing I. Berikut juga saya lampirkan dokumen undangan ujian skripsi saya.  Sekian yang ingin saya sampaikan. Jika ada salah kata, saya mohon maaf.  Salam, [MHS] ",1,1.0,35,3,"['selamat', 'pagi', 'mohon', 'maaf', 'ganggu', 'mahasiswa', 'mahasiswa', 'bimbing', 'skripsi', 'undang', 'hadir', 'uji', 'skripsi', 'rabu', 'tanggal', '13', 'januari', '2021', '10', '30', 'bimbing', 'lampir', 'dokumen', 'undang', 'uji', 'skripsi', 'sekian', 'salah', 'mohon', 'maaf', 'salam', 'mahasiswa']",35_3
184,12/1/21,mahasiswa,<DOC>,1,1.0,35,3,['doc'],35_3
185,12/1/21,dosen,"Baik [MHS]. Terimakasih.  Usahakan besok jam 07.00 ijin request link g-meet/zoom ke penguji ke-1. Tunggu sampai dibalas oleh beliau.  Jika sdh dapat link tersebut, silahkan dishare ke dosbing dan penguji ke-2. ",1,1.0,35,3,"['mahasiswa', 'terima kasih', 'usaha', 'besok', 'jam', '07', '00', 'izin', 'request', 'link', 'google meet', 'zoom', 'uji', 'ke-1', 'tunggu', 'balas', 'beliau', 'link', 'silah', 'dishare', 'dosen pembimbing', 'uji', 'ke-2']",35_3
186,12/1/21,mahasiswa,"Baik pak, akan saya lakukan besok. ",1,1.0,35,3,"['laku', 'besok']",35_3
0,10/7/20,mahasiswa,"Assalamualaikum Wr. Wb. Selamat siang Pak [DOSEN] . Semoga Bapak dan keluarga dalam keadaan sehat selalu. Mohon maaf mengganggu waktu Bapak. Perkenalkan nama saya [MHS]  dari Program Studi Teknik Informatika angkatan 2017 yang saat ini berfokus pada keminatan Komputasi Cerdas. Sebelumnya mohon maaf Pak, izin menginformasikan bahwa semester ini saya sedang mengajukan proposal skripsi dengan judul “Analisis Sentimen Di Twitter Tentang New Normal Dengan Pembentukan Daftar Stopword Zipf Law dan Pembobotan Emoji”. Untuk dosen pembimbing 1 saya adalah Ibu dosen Arum Sari, S.Kom, M.Kom dan untuk dosen pembimbing 2 adalah Bapak  Santoso, S.Si., M.Kom. Saya mohon bimbingan dari Bapak sebagai dosen pembimbing 2. Mohon maaf jika terdapat salah kata Pak. Terima kasih Pak . Wassalamualaikum Wr. Wb.",1,-1.0,0,4,"['assalamualaikum', 'wr', 'wb', 'selamat', 'siang', 'dosen', 'moga', 'keluarga', 'sehat', 'mohon', 'maaf', 'ganggu', 'kenal', 'nama', 'mahasiswa', 'program', 'studi', 'teknik', 'informatika', 'angkat', '2017', 'fokus', 'minat', 'komputasi', 'cerdas', 'mohon', 'maaf', 'izin', 'informasi', 'semester', 'aju', 'proposal', 'skripsi', 'judul', 'analisis', 'sentimen', 'twitter', 'new', 'normal', 'bentuk', 'daftar', 'stopword', 'zipf', 'law', 'bobot', 'emoji', 'dosen', 'bimbing', '1', 'dosen', 'arum', 'sari', 'kom', 'kom', 'dosen', 'bimbing', '2', 'santoso', 'si', 'kom', 'mohon', 'bimbing', 'dosen', 'bimbing', '2', 'mohon', 'maaf', 'salah', 'terima', 'kasih', 'wassalamualaikum', 'wr', 'wb']",0_4
1,10/7/20,dosen,Wa'alaikumsalam.. ok,1,-1.0,0,4,"['wa', 'alaikumsalam', 'oke']",0_4
2,10/7/20,mahasiswa,"Baik Pak , Terima kasih Pak. Mohon maaf Pak, saya izin bertanya terkait ketersediaan jadwal Bapak untuk melakukan P0 dan untuk P0 nya diadakan bersama atau terpisah Pak?",1,-1.0,0,4,"['terima', 'kasih', 'mohon', 'maaf', 'izin', 'kait', 'sedia', 'jadwal', 'laku', 'p0', 'p0', 'nya', 'pisah']",0_4
3,10/7/20,dosen,Terpisah gpp,1,-1.0,0,4,"['pisah', 'tidak apa-apa']",0_4
4,10/7/20,mahasiswa,Baik Pak . Terima kasih Pak. Saya coba konfirmasikan kembali ke Bu [DOSEN] sebagai dosen pembimbing 1 saya. Kemudian berikut saya lampirkan proposal skripsi yang saya kerjakan sebelumnya Pak.,1,-1.0,0,4,"['terima', 'kasih', 'coba', 'konfirmasi', 'dosen', 'dosen', 'bimbing', '1', 'lampir', 'proposal', 'skripsi', 'kerja']",0_4
5,10/7/20,mahasiswa,<DOC>,1,-1.0,0,4,['doc'],0_4
6,10/7/20,mahasiswa,Mungkin dari Bapak terdapat saran atau tambahan terkait proposal skripsi saya Pak. Terima kasih Pak .,-1,-1.0,0,4,"['saran', 'kait', 'proposal', 'skripsi', 'terima', 'kasih']",0_4
7,10/12/20,mahasiswa,"Assalamualaikum Wr. Wb. Selamat siang Pak . Mohon maaf mengganggu waktu Bapak. Saya [MHS] salah satu bimbingan Bapak. Mohon maaf sebelumnya, Izin bertanya terkait proposal yang saya kirim kemarin Pak. Apakah terdapat revisi atau saran dari Bapak terkait proposal saya Pak? Kemudian izin bertanya juga terkait jadwal P0, kapan waktu Bapak bersedia untuk saya P0 Pak? Terima kasih Pak .",1,1.0,1,4,"['assalamualaikum', 'wr', 'wb', 'selamat', 'siang', 'mohon', 'maaf', 'ganggu', 'mahasiswa', 'salah', 'bimbing', 'mohon', 'maaf', 'izin', 'kait', 'proposal', 'kirim', 'kemarin', 'revisi', 'saran', 'kait', 'proposal', 'izin', 'kait', 'jadwal', 'p0', 'sedia', 'p0', 'terima', 'kasih']",1_4
8,10/12/20,dosen,Seluruh Gambar dan Tabel harus dirujuk di kalimat agar tidak sekedar tempel.,1,1.0,1,4,"['gambar', 'tabel', 'rujuk', 'kalimat', 'dar', 'tempel']",1_4
9,10/12/20,dosen,Contoh Tabel 2.1. dst . Tahapan Tokenisasi dapat ditunjukkan pada Gambar 2.1. (bukan Table 2.1 --> ubah ke dalam bahasa indonesia). Gunakan cara yg sama untuk seluruh tabel,1,1.0,1,4,"['contoh', 'tabel', '2', '1', 'dan seterusnya', 'tahap', 'tokenisasi', 'gambar', '2', '1', 'table', '2', '1', '--', 'ubah', 'bahasa', 'indonesia', 'tabel']",1_4
10,10/12/20,mahasiswa,Baik Pak. Saya perbaiki kembali proposal saya Pak. Terima kasih banyak Pak .,1,1.0,1,4,"['proposal', 'terima', 'kasih']",1_4
11,10/13/20,mahasiswa,Assalamualaikum Wr. Wb. Selamat siang Pak . Mohon maaf mengganggu waktu Bapak. Saya [MHS] sebagai mahasiswa bimbingan skripsi Bapak. Maksud saya menghubungi Bapak hari ini untuk menyerahkan proposal sesuai dengan revisi atau saran yang telah Bapak berikan kemarin. Berikut saya lampirkan untuk proposalnya Pak.,1,1.0,2,4,"['assalamualaikum', 'wr', 'wb', 'selamat', 'siang', 'mohon', 'maaf', 'ganggu', 'mahasiswa', 'mahasiswa', 'bimbing', 'skripsi', 'maksud', 'hubung', 'serah', 'proposal', 'sesuai', 'revisi', 'saran', 'ikan', 'kemarin', 'lampir', 'proposal']",2_4
12,10/13/20,mahasiswa,<DOC>,1,1.0,2,4,['doc'],2_4
13,10/13/20,mahasiswa,Apabila terdapat hal yang kurang dalam proposal tersebut saya mohon bimbingan dari Bapak. Terimakasih Pak .,1,1.0,2,4,"['proposal', 'mohon', 'bimbing', 'terima kasih']",2_4
14,10/13/20,dosen,"P0, ke Pemb1 ya.. Saya manut",1,1.0,2,4,"['p0', 'pemb1', 'iya', 'manut']",2_4
15,10/13/20,mahasiswa,Baik Pak. Akan saya konfirmasikan kembali ke Bu [DOSEN] terkait P0nya Pak. Terima kasih Pak .,1,1.0,2,4,"['konfirmasi', 'dosen', 'kait', 'p0nya', 'terima', 'kasih']",2_4
20,10/22/20,mahasiswa,Assalamualaikum Wr. Wb. Selamat siang Pak . Mohon maaf mengganggu waktu Bapak. Saya [MHS] mahasiswa bimbingan skripsi Bapak. Mohon maaf juga sebelumnya Pak. Maksud saya menghubungi Bapak karena ingin konsultasi terkait proposal. Saya izin untuk menyampaikan informasi bahwa pada hari selasa kemarin saya sudah melakukan P0 dan melakukan bimbingan dengan Bu dosen selaku dosen pembimbing 1. Saya menanyakan tentang rumusan masalah yang ada pada proposal saya Pak. Kemudian dari Bu dosen memberikan saran jika rumusan masalah di proposal saya perlu diganti karena penelitian saya adalah non implementatif. Jadi pada rumusan masalah tidak perlu adanya implementasi metode. Dengan langsung saya mengganti rumusan masalah yang saya buat sebelumnya dan telah disetujui oleh Bu dosen untuk rumusan masalah yang baru. Berikut saya lampirkan proposal saya Pak.,1,-1.0,4,4,"['assalamualaikum', 'wr', 'wb', 'selamat', 'siang', 'mohon', 'maaf', 'ganggu', 'mahasiswa', 'mahasiswa', 'bimbing', 'skripsi', 'mohon', 'maaf', 'maksud', 'hubung', 'konsultasi', 'kait', 'proposal', 'izin', 'informasi', 'selasa', 'kemarin', 'laku', 'p0', 'laku', 'bimbing', 'dosen', 'dosen', 'bimbing', '1', 'rumus', 'proposal', 'dosen', 'saran', 'rumus', 'proposal', 'ganti', 'teliti', 'non', 'implementatif', 'rumus', 'implementasi', 'metode', 'langsung', 'ganti', 'rumus', 'tuju', 'dosen', 'rumus', 'lampir', 'proposal']",4_4
21,10/22/20,mahasiswa,<DOC>,1,-1.0,4,4,['doc'],4_4
22,10/22/20,mahasiswa,Saya mohon bimbingan dari Bapak apabila terdapat saran atau revisi terkait proposal saya. Terima kasih Pak .,1,-1.0,4,4,"['mohon', 'bimbing', 'saran', 'revisi', 'kait', 'proposal', 'terima', 'kasih']",4_4
30,11/17/20,mahasiswa,"Assalamualaikum Wr. Wb. Selamat pagi Pak [DOSEN]. Mohon maaf mengganggu waktu Bapak. Saya  mahasiswa bimbingan skripsi Bapak. Mohon maaf juga sebelumnya Pak, maksud saya menghubungi Bapak ingin memberikan progresan serta ingin melakukan konsultasi terkait laporan skripsi saya. Pada 2 minggu lalu Bapak telah memberikan saran atau revisi terkait penulisan pada proposal skripsi saya. Saya telah memperbaiki sesuai saran dari Bapak serta saya telah menyelesaikan revisian tersebut serta progresan skripsi saya telah selesai hingga Bab 4. Berikut saya lampirkan laporan skripsi saya yang telah saya kerjakan Pak.",1,-1.0,6,4,"['assalamualaikum', 'wr', 'wb', 'selamat', 'pagi', 'dosen', 'mohon', 'maaf', 'ganggu', 'mahasiswa', 'bimbing', 'skripsi', 'mohon', 'maaf', 'maksud', 'hubung', 'progres', 'laku', 'konsultasi', 'kait', 'lapor', 'skripsi', '2', 'minggu', 'saran', 'revisi', 'kait', 'tulis', 'proposal', 'skripsi', 'sesuai', 'saran', 'selesai', 'revisi', 'progres', 'skripsi', 'selesai', 'bab', '4', 'lampir', 'lapor', 'skripsi', 'kerja']",6_4
31,11/17/20,mahasiswa,<DOC>,1,-1.0,6,4,['doc'],6_4
32,11/17/20,dosen,Wa'alaikumsalam.. Ok. Saya cek InsyaAllah nanti ya,1,-1.0,6,4,"['wa', 'alaikumsalam', 'oke', 'cek', 'insyaallah', 'iya']",6_4
33,11/17/20,mahasiswa,"Baik Pak. Mohon bimbingannya Pak terkait dokumen pada laporan skripsi saya. Kemudian mohon maaf juga sebelumnya Pak, izin bertanya terkait P1. Pada filkomApps, saya telah melewati masa P1 dimana telah dilakukan verifikasi oleh Bapak serta Bu dosen sebagai dosen pembimbing 1 dan juga saya telah mendapatkan berita acara yang berisikan penilaian kemajuan P1. Apakah untuk P1 ke Bapak tidak perlu dilakukan seperti halnya presentasi atau Bagaimana ya Pak? Mohon maaf jika terdapat salah kata Pak. Terima kasih Pak .",1,-1.0,6,4,"['mohon', 'bimbing', 'kait', 'dokumen', 'lapor', 'skripsi', 'mohon', 'maaf', 'izin', 'kait', 'p1', 'filkomapps', 'p1', 'laku', 'verifikasi', 'dosen', 'dosen', 'bimbing', '1', 'berita', 'acara', 'risi', 'nilai', 'maju', 'p1', 'p1', 'laku', 'presentasi', 'iya', 'mohon', 'maaf', 'salah', 'terima', 'kasih']",6_4
34,11/17/20,dosen,"Secara umum penulisan sdh baik, namun sekalian halaman pengesahan direvisi, sama abstrak dibuat (abstrak ada 3 bagian dalam skripsi, yang memuat latar belakang, metode yg digunakan dan hasil). ini berarti mengggambarkan seluruh isi skripsi. kalau msh tahap perancangan metode berarti bisa dibuat 2 paragraf.",1,-1.0,6,4,"['tulis', 'halaman', 'kesah', 'revisi', 'abstrak', 'abstrak', '3', 'skripsi', 'muat', 'latar', 'metode', 'hasil', 'arti', 'mengggambarkan', 'isi', 'skripsi', 'tahap', 'ancang', 'metode', 'arti', '2', 'paragraf']",6_4
35,11/17/20,mahasiswa,"Alhamdulillah Pak, Baik Pak, saya coba menyusun kembali bagian dari lembar pengesahan dan abstraknya Pak. Mohon maaf sebelumnya Pak, izin bertanya kembali terkait 2 paragraf tersebut, karena saat ini saya masih dalam tahapan perancangan metode, berarti saya coba membuat abstrak yang berisikan latar belakang dan metode yang digunakan sebanyak 2 paragraf sekaligus mencicil, apakah seperti itu ya Pak? Mohon maaf Pak jika terdapat salah kata dalam pertanyaan saya.",1,-1.0,6,4,"['alhamdulillah', 'coba', 'susun', 'lembar', 'kesah', 'abstrak', 'mohon', 'maaf', 'izin', 'kait', '2', 'paragraf', 'tahap', 'ancang', 'metode', 'arti', 'coba', 'abstrak', 'risi', 'latar', 'metode', '2', 'paragraf', 'cicil', 'iya', 'mohon', 'maaf', 'salah']",6_4
36,11/17/20,dosen,"Maksudnya abstrak sementara 2 bagian.. Kan hasil belum ada, tetapi bisa dibuat sampai metode",1,-1.0,6,4,"['maksud', 'abstrak', '2', 'hasil', 'metode']",6_4
37,11/17/20,mahasiswa,"Baik Pak. Saya coba membuat bagian latar belakang dan metode yang saya gunakan terlebih dahulu untuk dapat dimasukkan ke bagian abstrak. Kemudian mohon maaf Pak, izin bertanya terkait P1. Untuk P1nya sendiri, Apakah saya tidak perlu melakukan presentasi ke Bapak atau terdapat pilihan lain agar dapat melakukan P1 kepada Bapak?",1,-1.0,6,4,"['coba', 'latar', 'metode', 'masuk', 'abstrak', 'mohon', 'maaf', 'izin', 'kait', 'p1', 'p1nya', 'laku', 'presentasi', 'pilih', 'laku', 'p1']",6_4
38,12/10/20,mahasiswa,"Assalamualaikum Wr. Wb. Selamat sore Pak [DOSEN]. Mohon maaf mengganggu waktu Bapak. Saya [MHS] mahasiswa bimbingan skripsi Bapak. Sebelumnya mohon maaf Pak. Maksud saya menghubungi Bapak ingin memberikan progres terkait skripsi saya. Jadi disini saya telah mengerjakan skripsi hingga Bab 5 dan mencoba untuk mengerjakan sedikit demi sedikit pada bagian abstrak yang juga masih dalam bahasa indonesia saja Pak. Kemudian untuk saat ini masih mengerjakan tahapan pengujian untuk mencari nilai K dalam penggunaan klasifikasi KNN dimana saya mencoba melakukan pengujian nilai K dari 1 hingga 49 serta mencari akurasi terbaiknya dan mencoba untuk menghilangkan emoji dari dataset. Hingga saat ini akurasi terbaiknya adalah 47,5%. Berikut saya lampirkan skripsi yang telah saya kerjakan Pak.",1,-1.0,7,4,"['assalamualaikum', 'wr', 'wb', 'selamat', 'sore', 'dosen', 'mohon', 'maaf', 'ganggu', 'mahasiswa', 'mahasiswa', 'bimbing', 'skripsi', 'mohon', 'maaf', 'maksud', 'hubung', 'progres', 'kait', 'skripsi', 'kerja', 'skripsi', 'bab', '5', 'coba', 'kerja', 'abstrak', 'bahasa', 'indonesia', 'kerja', 'tahap', 'uji', 'cari', 'nilai', 'k', 'klasifikasi', 'knn', 'coba', 'laku', 'uji', 'nilai', 'k', '1', '49', 'cari', 'akurasi', 'coba', 'hilang', 'emoji', 'dataset', 'akurasi', '47', '5', 'lampir', 'skripsi', 'kerja']",7_4
39,12/10/20,mahasiswa,<DOC>,1,-1.0,7,4,['doc'],7_4
40,12/10/20,mahasiswa,Mohon bimbingannya Pak jika terdapat saran atau revisi tentang laporan skripsi saya. Terima kasih Pak .,1,-1.0,7,4,"['mohon', 'bimbing', 'saran', 'revisi', 'lapor', 'skripsi', 'terima', 'kasih']",7_4
41,12/10/20,dosen,Wa'alaikumsalam.. ok,-1,-1.0,7,4,"['wa', 'alaikumsalam', 'oke']",7_4
42,12/22/20,mahasiswa,"Assalamualaikum Wr. Wb. Selamat siang Pak [DOSEN]. Mohon maaf mengganggu waktu Bapak. Saya [MHS] mahasiswa bimbingan skripsi Bapak. Sebelumnya mohon maaf Pak, maksud saya menghubungi Bapak ingin menanyakan terkait saran atau revisi terkait dokumen skripsi yang saya kirim minggu lalu. Apakah terdapat saran atau revisi dari Bapak terkait penulisan skripsi saya Pak? Kemudian mohon maaf sebelumnya Pak, saya berencana untuk melakukan pendaftaran semhas semester ini. Untuk logbooknya sendiri masih kurang 2 belum terhitung untuk bimbingan hari ini Pak, itu bagaimana ya Pak? Sedangkan untuk batas pendaftaran semhas besok tanggal 23 Desember 2020. Kemudian izin memberikan progres Pak, jadi saya telah mengerjakan skripsi saya serta jurnal, berikut saya kirimkan skripsi dan jurnal saya.",1,1.0,8,4,"['assalamualaikum', 'wr', 'wb', 'selamat', 'siang', 'dosen', 'mohon', 'maaf', 'ganggu', 'mahasiswa', 'mahasiswa', 'bimbing', 'skripsi', 'mohon', 'maaf', 'maksud', 'hubung', 'kait', 'saran', 'revisi', 'kait', 'dokumen', 'skripsi', 'kirim', 'minggu', 'saran', 'revisi', 'kait', 'tulis', 'skripsi', 'mohon', 'maaf', 'rencana', 'laku', 'daftar', 'seminar hasil', 'semester', 'logbooknya', '2', 'hitung', 'bimbing', 'iya', 'batas', 'daftar', 'seminar hasil', 'besok', 'tanggal', '23', 'desember', '2020', 'izin', 'progres', 'kerja', 'skripsi', 'jurnal', 'kirim', 'skripsi', 'jurnal']",8_4
43,12/22/20,mahasiswa,<DOC>,1,1.0,8,4,['doc'],8_4
44,12/22/20,mahasiswa,<DOC>,1,1.0,8,4,['doc'],8_4
45,12/22/20,mahasiswa,Mohon bimbingannya Pak. Mungkin terdapat saran atau revisi dari Bapak terkait penulisan skripsi saya. Terima kasih banyak Pak . Mohon maaf mengganggu waktunya.,1,1.0,8,4,"['mohon', 'bimbing', 'saran', 'revisi', 'kait', 'tulis', 'skripsi', 'terima', 'kasih', 'mohon', 'maaf', 'ganggu']",8_4
46,12/22/20,dosen,"Secara umum tata tulisan sdh bagus, tgl lembar pengesahan kosong dulu, orisinalitas dibuat tgl skrg.",1,1.0,8,4,"['tata', 'tulis', 'bagus', 'tanggal', 'lembar', 'kesah', 'kosong', 'orisinalitas', 'tanggal']",8_4
47,12/22/20,mahasiswa,"Alhamdulillah, baik Pak, saya coba perbaiki pada halaman tersebut. Untuk logbook di filkomApps saya telah mengisi kembali Pak. Insyaallah saya segera melakukan pendaftaran semhas skripsi Pak. Terima kasih banyak Pak [DOSEN]. Mohon maaf mengganggu waktunya.",1,1.0,8,4,"['alhamdulillah', 'coba', 'halaman', 'logbook', 'filkomapps', 'isi', 'insyaallah', 'laku', 'daftar', 'seminar hasil', 'skripsi', 'terima', 'kasih', 'dosen', 'mohon', 'maaf', 'ganggu']",8_4
48,12/22/20,mahasiswa,"Sebelumnya mohon maaf Pak, izin memberikan informasi kembali untuk dari Bu [DOSEN] sendiri memberikan saran merubah judul skripsi menjadi ""Pembentukan Daftar Stopword Zipf Law dan Pembobotan Emoji pada Analisis Sentimen di Twitter"". Apakah dari Bapak terdapat saran atau revisi terkait judul skripsi saya Pak? Untuk judul skripsi tidak jauh berbeda dengan sebelumnya Pak, hanya dihilangkan kata ""new normal"" dan ""tweet"". Dari Bu dosen sendiri memberikan saran judulnya diganti seperti itu Pak.",1,1.0,8,4,"['mohon', 'maaf', 'izin', 'informasi', 'dosen', 'saran', 'rubah', 'judul', 'skripsi', 'bentuk', 'daftar', 'stopword', 'zipf', 'law', 'bobot', 'emoji', 'analisis', 'sentimen', 'twitter', 'saran', 'revisi', 'kait', 'judul', 'skripsi', 'judul', 'skripsi', 'beda', 'hilang', 'new', 'normal', 'tweet', 'dosen', 'saran', 'judul', 'ganti']",8_4
49,12/22/20,dosen,Gpp,1,1.0,8,4,['tidak apa-apa'],8_4
50,12/22/20,mahasiswa,"Baik Pak, berikut saya lampirkan juga form pergantian judul skripsi yang diperlukan persetujuan dari dosen pembimbing dan saya juga telah meminta tanda tangan dari Bu [DOSEN] Pak.",1,1.0,8,4,"['lampir', 'form', 'ganti', 'judul', 'skripsi', 'tuju', 'dosen', 'bimbing', 'tanda', 'tangan', 'dosen']",8_4
51,12/22/20,mahasiswa,<DOC>,1,1.0,8,4,['doc'],8_4
52,1/7/21,mahasiswa,"Assalamualaikum Wr. Wb. Selamat siang Pak [DOSEN]. Mohon maaf mengganggu waktu Bapak. Saya [MHS] mahasiswa bimbingan skripsi Bapak. Sebelumnya mohon maaf Pak, izin memberikan informasi. Alhamdulillah saya telah melaksanakan seminar hasil skripsi pada tanggal 30 Desember 2020 dengan dosen fasilitator Pak [DOSEN], M.Kom. Untuk saat ini saya menunggu jadwal sidangnya Pak dikarenakan juga saya baru saja pada hari ini mengirimkan berkas pelengkapnya yaitu transkrip nilai final. Kemudian mohon maaf juga Pak, izin bertanya terkait form pergantian judul skripsi saya yang telah saya kirim sebelumnya, apakah sudah ditanda tangani Pak? Untuk berjaga - jaga jika diminta oleh pihak akademik Pak. Mohon maaf jika terdapat salah kata serta mohon Pak karena baru mengabarkan terkait seminar hasilnya hari ini. Terima kasih Pak .",1,-1.0,9,4,"['assalamualaikum', 'wr', 'wb', 'selamat', 'siang', 'dosen', 'mohon', 'maaf', 'ganggu', 'mahasiswa', 'mahasiswa', 'bimbing', 'skripsi', 'mohon', 'maaf', 'izin', 'informasi', 'alhamdulillah', 'laksana', 'seminar', 'hasil', 'skripsi', 'tanggal', '30', 'desember', '2020', 'dosen', 'fasilitator', 'dosen', 'kom', 'tunggu', 'jadwal', 'sidang', 'kirim', 'berkas', 'lengkap', 'transkrip', 'nilai', 'final', 'mohon', 'maaf', 'izin', 'kait', 'form', 'ganti', 'judul', 'skripsi', 'kirim', 'tanda', 'tangan', 'jaga', '-', 'jaga', 'akademik', 'mohon', 'maaf', 'salah', 'mohon', 'abar', 'kait', 'seminar', 'hasil', 'terima', 'kasih']",9_4
53,1/7/21,dosen,Wa'alaikumsalam.. ok,1,-1.0,9,4,"['wa', 'alaikumsalam', 'oke']",9_4
54,1/7/21,mahasiswa,"Baik Pak, mohon maaf sebelumnya Pak, izin bertanya kembali dan konfirmasi, untuk form pergantian judulnya apakah saya perlu mengirimkannya kembali Pak?",1,-1.0,9,4,"['mohon', 'maaf', 'izin', 'konfirmasi', 'form', 'ganti', 'judul', 'kirim']",9_4
59,1/11/21,mahasiswa,"Assalamualaikum Wr. Wb. Selamat pagi Pak [DOSEN] . Mohon maaf mengganggu waktu Bapak. Saya [MHS] mahasiswa bimbingan skripsi Bapak. Sebelumnya mohon maaf Pak, izin memberikan informasi bahwa dari Pak [DOSEN] sebagai dosen penguji pertama telah membuat link google meet untuk sidang saya nanti pada pukul 09.15 - 10.30. Berikut saya lampirkan link google meetnya Pak. meet.google.com/cso-bafb-fgq Mohon maaf jika terdapat salah kata Pak. Terima kasih banyak Pak [DOSEN].",1,-1.0,11,4,"['assalamualaikum', 'wr', 'wb', 'selamat', 'pagi', 'dosen', 'mohon', 'maaf', 'ganggu', 'mahasiswa', 'mahasiswa', 'bimbing', 'skripsi', 'mohon', 'maaf', 'izin', 'informasi', 'dosen', 'dosen', 'uji', 'link', 'google', 'meet', 'sidang', '09', '15', '-', '10', '30', 'lampir', 'link', 'google', 'meetnya', 'meet', 'google', 'com', 'cso-bafb-fgq', 'mohon', 'maaf', 'salah', 'terima', 'kasih', 'dosen']",11_4
