timestamp,sender,messages,sentiment_per_chat,sentiment_per_sesi
10/7/20,mahasiswa,"Assalamualaikum Wr. Wb. Selamat siang Pak [DOSEN] . Semoga Bapak dan keluarga dalam keadaan sehat selalu. Mohon maaf mengganggu waktu Bapak. Perkenalkan nama saya [MHS]  dari Program Studi Teknik Informatika angkatan 2017 yang saat ini berfokus pada keminatan Komputasi Cerdas. Sebelumnya mohon maaf Pak, izin menginformasikan bahwa semester ini saya sedang mengajukan proposal skripsi dengan judul “Analisis Sentimen Di Twitter Tentang New Normal Dengan Pembentukan Daftar Stopword Zipf Law dan Pembobotan Emoji”. Untuk dosen pembimbing 1 saya adalah Ibu dosen Arum Sari, S.Kom, M.Kom dan untuk dosen pembimbing 2 adalah Bapak  Santoso, S.Si., M.Kom. Saya mohon bimbingan dari Bapak sebagai dosen pembimbing 2. Mohon maaf jika terdapat salah kata Pak. Terima kasih Pak . Wassalamualaikum Wr. Wb.",1,-1
10/7/20,dosen,Wa'alaikumsalam.. ok,1,-1
10/7/20,mahasiswa,"Baik Pak , Terima kasih Pak. Mohon maaf Pak, saya izin bertanya terkait ketersediaan jadwal Bapak untuk melakukan P0 dan untuk P0 nya diadakan bersama atau terpisah Pak?",1,-1
10/7/20,dosen,Terpisah gpp,1,-1
10/7/20,mahasiswa,Baik Pak . Terima kasih Pak. Saya coba konfirmasikan kembali ke Bu [DOSEN] sebagai dosen pembimbing 1 saya. Kemudian berikut saya lampirkan proposal skripsi yang saya kerjakan sebelumnya Pak.,1,-1
10/7/20,mahasiswa,<DOC>,1,-1
10/7/20,mahasiswa,Mungkin dari Bapak terdapat saran atau tambahan terkait proposal skripsi saya Pak. Terima kasih Pak .,-1,-1
10/12/20,mahasiswa,"Assalamualaikum Wr. Wb. Selamat siang Pak . Mohon maaf mengganggu waktu Bapak. Saya [MHS] salah satu bimbingan Bapak. Mohon maaf sebelumnya, Izin bertanya terkait proposal yang saya kirim kemarin Pak. Apakah terdapat revisi atau saran dari Bapak terkait proposal saya Pak? Kemudian izin bertanya juga terkait jadwal P0, kapan waktu Bapak bersedia untuk saya P0 Pak? Terima kasih Pak .",1,1
10/12/20,dosen,Seluruh Gambar dan Tabel harus dirujuk di kalimat agar tidak sekedar tempel.,1,1
10/12/20,dosen,Contoh Tabel 2.1. dst . Tahapan Tokenisasi dapat ditunjukkan pada Gambar 2.1. (bukan Table 2.1 --> ubah ke dalam bahasa indonesia). Gunakan cara yg sama untuk seluruh tabel,1,1
10/12/20,mahasiswa,Baik Pak. Saya perbaiki kembali proposal saya Pak. Terima kasih banyak Pak .,1,1
10/13/20,mahasiswa,Assalamualaikum Wr. Wb. Selamat siang Pak . Mohon maaf mengganggu waktu Bapak. Saya [MHS] sebagai mahasiswa bimbingan skripsi Bapak. Maksud saya menghubungi Bapak hari ini untuk menyerahkan proposal sesuai dengan revisi atau saran yang telah Bapak berikan kemarin. Berikut saya lampirkan untuk proposalnya Pak.,1,1
10/13/20,mahasiswa,<DOC>,1,1
10/13/20,mahasiswa,Apabila terdapat hal yang kurang dalam proposal tersebut saya mohon bimbingan dari Bapak. Terimakasih Pak .,1,1
10/13/20,dosen,"P0, ke Pemb1 ya.. Saya manut",1,1
10/13/20,mahasiswa,Baik Pak. Akan saya konfirmasikan kembali ke Bu [DOSEN] terkait P0nya Pak. Terima kasih Pak .,1,1
10/14/20,mahasiswa,"Assalamualaikum Wr. Wb. Selamat sore Pak . Mohon maaf mengganggu waktu Bapak. Mohon maaf sebelumnya Pak, izin untuk melakukan konfirmasi ulang kepada Bapak terkait P0. Apakah disini saya tidak perlu melakukan presentasi P0 kepada Bapak dan diserahkan kepada dosen pembimbing 1 sepenuhnya atau bagaimana ya Pak? Sekali lagi mohon maaf Pak karena dari saya masih kurang paham Pak dan mohon maaf jika terdapat salah kata.",1,1
10/14/20,dosen,Wa'alaikumsalam.. Iya,1,1
10/14/20,dosen,Saya approve & saran,1,1
10/14/20,mahasiswa,Baik Pak. Saya coba konfirmasi kembali ke Bu [DOSEN]. Terima kasih Pak .,1,1
10/22/20,mahasiswa,Assalamualaikum Wr. Wb. Selamat siang Pak . Mohon maaf mengganggu waktu Bapak. Saya [MHS] mahasiswa bimbingan skripsi Bapak. Mohon maaf juga sebelumnya Pak. Maksud saya menghubungi Bapak karena ingin konsultasi terkait proposal. Saya izin untuk menyampaikan informasi bahwa pada hari selasa kemarin saya sudah melakukan P0 dan melakukan bimbingan dengan Bu dosen selaku dosen pembimbing 1. Saya menanyakan tentang rumusan masalah yang ada pada proposal saya Pak. Kemudian dari Bu dosen memberikan saran jika rumusan masalah di proposal saya perlu diganti karena penelitian saya adalah non implementatif. Jadi pada rumusan masalah tidak perlu adanya implementasi metode. Dengan langsung saya mengganti rumusan masalah yang saya buat sebelumnya dan telah disetujui oleh Bu dosen untuk rumusan masalah yang baru. Berikut saya lampirkan proposal saya Pak.,1,-1
10/22/20,mahasiswa,<DOC>,1,-1
10/22/20,mahasiswa,Saya mohon bimbingan dari Bapak apabila terdapat saran atau revisi terkait proposal saya. Terima kasih Pak .,1,-1
11/3/20,mahasiswa,"Assalamualaikum Wr. Wb. Selamat siang Pak . Mohon maaf mengganggu waktu Bapak. Saya [MHS] mahasiswa bimbingan skripsi Bapak. Mohon maaf juga sebelumnya Pak, maksud saya menghubungi Bapak karena ingin melakukan konsultasi tentang proposal yang saya kerjakan dan telah saya kirim sebelumnya Pak. Apakah terdapat revisi atau saran dari Bapak terkait proposal yang saya kerjakan Pak? Kemudian mohon maaf juga sebelumnya Pak, saya izin untuk menyampaikan informasi bahwa pada tanggal 23 Oktober 2020 saya telah melakukan upload proposal dan telah dilakukan verifikasi oleh Bu dosen, Pak dan progresan saya saat ini sudah mengerjakan hingga Bab 4 Pak. Apakah saya kirimkan juga Pak pengerjaan skripsi hingga bab 4nya? Terima kasih Pak . Mohon maaf jika terdapat salah kata Pak.",1,1
11/3/20,dosen,"Dicek lagi, seluruh bhs Inggris cetak italic termasuk daftar isi yg menggunakan bhs inggris",1,1
11/3/20,dosen,Rujukan tabel atau gambar disesuaikan judul tabel atau gambar. Gunakan Huruf besar di awal. contoh ditunjukkan pada Gambar 4.1. Atau Tabel 4.1.,1,1
11/3/20,mahasiswa,"Baik Pak [DOSEN]. Mohon maaf sebelumnya Pak, izin bertanya kembali terkait pembentukan diagram alir. Apakah diharuskan untuk dikerjakan langsung dengan menggunakan tool shape di microsoft word atau boleh menggunakan tool diluar microsoft word seperti melalui website draw.io, Pak?",1,1
11/3/20,dosen,"Boleh, yg mudah diedit & yg disukai.",1,1
11/3/20,dosen,"Vidio juga boleh, draw.io juga boleh",1,1
11/3/20,mahasiswa,Baik Pak [DOSEN]. Mungkin dari saya untuk pertanyaan hari ini sudah cukup Pak. Saya akan melakukan pengekan kembali laporan saya dan memperbaiki sesuai saran atau revisi dari Bapak. Terima kasih Pak . Sekali lagi mohon maaf mengganggu waktu Bapak dan mohon maaf jika terdapat salah kata Pak.,1,1
11/17/20,mahasiswa,"Assalamualaikum Wr. Wb. Selamat pagi Pak [DOSEN]. Mohon maaf mengganggu waktu Bapak. Saya  mahasiswa bimbingan skripsi Bapak. Mohon maaf juga sebelumnya Pak, maksud saya menghubungi Bapak ingin memberikan progresan serta ingin melakukan konsultasi terkait laporan skripsi saya. Pada 2 minggu lalu Bapak telah memberikan saran atau revisi terkait penulisan pada proposal skripsi saya. Saya telah memperbaiki sesuai saran dari Bapak serta saya telah menyelesaikan revisian tersebut serta progresan skripsi saya telah selesai hingga Bab 4. Berikut saya lampirkan laporan skripsi saya yang telah saya kerjakan Pak.",1,-1
11/17/20,mahasiswa,<DOC>,1,-1
11/17/20,dosen,Wa'alaikumsalam.. Ok. Saya cek InsyaAllah nanti ya,1,-1
11/17/20,mahasiswa,"Baik Pak. Mohon bimbingannya Pak terkait dokumen pada laporan skripsi saya. Kemudian mohon maaf juga sebelumnya Pak, izin bertanya terkait P1. Pada filkomApps, saya telah melewati masa P1 dimana telah dilakukan verifikasi oleh Bapak serta Bu dosen sebagai dosen pembimbing 1 dan juga saya telah mendapatkan berita acara yang berisikan penilaian kemajuan P1. Apakah untuk P1 ke Bapak tidak perlu dilakukan seperti halnya presentasi atau Bagaimana ya Pak? Mohon maaf jika terdapat salah kata Pak. Terima kasih Pak .",1,-1
11/17/20,dosen,"Secara umum penulisan sdh baik, namun sekalian halaman pengesahan direvisi, sama abstrak dibuat (abstrak ada 3 bagian dalam skripsi, yang memuat latar belakang, metode yg digunakan dan hasil). ini berarti mengggambarkan seluruh isi skripsi. kalau msh tahap perancangan metode berarti bisa dibuat 2 paragraf.",1,-1
11/17/20,mahasiswa,"Alhamdulillah Pak, Baik Pak, saya coba menyusun kembali bagian dari lembar pengesahan dan abstraknya Pak. Mohon maaf sebelumnya Pak, izin bertanya kembali terkait 2 paragraf tersebut, karena saat ini saya masih dalam tahapan perancangan metode, berarti saya coba membuat abstrak yang berisikan latar belakang dan metode yang digunakan sebanyak 2 paragraf sekaligus mencicil, apakah seperti itu ya Pak? Mohon maaf Pak jika terdapat salah kata dalam pertanyaan saya.",1,-1
11/17/20,dosen,"Maksudnya abstrak sementara 2 bagian.. Kan hasil belum ada, tetapi bisa dibuat sampai metode",1,-1
11/17/20,mahasiswa,"Baik Pak. Saya coba membuat bagian latar belakang dan metode yang saya gunakan terlebih dahulu untuk dapat dimasukkan ke bagian abstrak. Kemudian mohon maaf Pak, izin bertanya terkait P1. Untuk P1nya sendiri, Apakah saya tidak perlu melakukan presentasi ke Bapak atau terdapat pilihan lain agar dapat melakukan P1 kepada Bapak?",1,-1
12/10/20,mahasiswa,"Assalamualaikum Wr. Wb. Selamat sore Pak [DOSEN]. Mohon maaf mengganggu waktu Bapak. Saya [MHS] mahasiswa bimbingan skripsi Bapak. Sebelumnya mohon maaf Pak. Maksud saya menghubungi Bapak ingin memberikan progres terkait skripsi saya. Jadi disini saya telah mengerjakan skripsi hingga Bab 5 dan mencoba untuk mengerjakan sedikit demi sedikit pada bagian abstrak yang juga masih dalam bahasa indonesia saja Pak. Kemudian untuk saat ini masih mengerjakan tahapan pengujian untuk mencari nilai K dalam penggunaan klasifikasi KNN dimana saya mencoba melakukan pengujian nilai K dari 1 hingga 49 serta mencari akurasi terbaiknya dan mencoba untuk menghilangkan emoji dari dataset. Hingga saat ini akurasi terbaiknya adalah 47,5%. Berikut saya lampirkan skripsi yang telah saya kerjakan Pak.",1,-1
12/10/20,mahasiswa,<DOC>,1,-1
12/10/20,mahasiswa,Mohon bimbingannya Pak jika terdapat saran atau revisi tentang laporan skripsi saya. Terima kasih Pak .,1,-1
12/10/20,dosen,Wa'alaikumsalam.. ok,-1,-1
12/22/20,mahasiswa,"Assalamualaikum Wr. Wb. Selamat siang Pak [DOSEN]. Mohon maaf mengganggu waktu Bapak. Saya [MHS] mahasiswa bimbingan skripsi Bapak. Sebelumnya mohon maaf Pak, maksud saya menghubungi Bapak ingin menanyakan terkait saran atau revisi terkait dokumen skripsi yang saya kirim minggu lalu. Apakah terdapat saran atau revisi dari Bapak terkait penulisan skripsi saya Pak? Kemudian mohon maaf sebelumnya Pak, saya berencana untuk melakukan pendaftaran semhas semester ini. Untuk logbooknya sendiri masih kurang 2 belum terhitung untuk bimbingan hari ini Pak, itu bagaimana ya Pak? Sedangkan untuk batas pendaftaran semhas besok tanggal 23 Desember 2020. Kemudian izin memberikan progres Pak, jadi saya telah mengerjakan skripsi saya serta jurnal, berikut saya kirimkan skripsi dan jurnal saya.",1,1
12/22/20,mahasiswa,<DOC>,1,1
12/22/20,mahasiswa,[DOC],1,1
12/22/20,mahasiswa,Mohon bimbingannya Pak. Mungkin terdapat saran atau revisi dari Bapak terkait penulisan skripsi saya. Terima kasih banyak Pak . Mohon maaf mengganggu waktunya.,1,1
12/22/20,dosen,"Secara umum tata tulisan sdh bagus, tgl lembar pengesahan kosong dulu, orisinalitas dibuat tgl skrg.",1,1
12/22/20,mahasiswa,"Alhamdulillah, baik Pak, saya coba perbaiki pada halaman tersebut. Untuk logbook di filkomApps saya telah mengisi kembali Pak. Insyaallah saya segera melakukan pendaftaran semhas skripsi Pak. Terima kasih banyak Pak [DOSEN]. Mohon maaf mengganggu waktunya.",1,1
12/22/20,mahasiswa,"Sebelumnya mohon maaf Pak, izin memberikan informasi kembali untuk dari Bu [DOSEN] sendiri memberikan saran merubah judul skripsi menjadi ""Pembentukan Daftar Stopword Zipf Law dan Pembobotan Emoji pada Analisis Sentimen di Twitter"". Apakah dari Bapak terdapat saran atau revisi terkait judul skripsi saya Pak? Untuk judul skripsi tidak jauh berbeda dengan sebelumnya Pak, hanya dihilangkan kata ""new normal"" dan ""tweet"". Dari Bu dosen sendiri memberikan saran judulnya diganti seperti itu Pak.",1,1
12/22/20,dosen,Gpp,1,1
12/22/20,mahasiswa,"Baik Pak, berikut saya lampirkan juga form pergantian judul skripsi yang diperlukan persetujuan dari dosen pembimbing dan saya juga telah meminta tanda tangan dari Bu [DOSEN] Pak.",1,1
12/22/20,mahasiswa,<DOC>,1,1
1/7/21,mahasiswa,"Assalamualaikum Wr. Wb. Selamat siang Pak [DOSEN]. Mohon maaf mengganggu waktu Bapak. Saya [MHS] mahasiswa bimbingan skripsi Bapak. Sebelumnya mohon maaf Pak, izin memberikan informasi. Alhamdulillah saya telah melaksanakan seminar hasil skripsi pada tanggal 30 Desember 2020 dengan dosen fasilitator Pak [DOSEN], M.Kom. Untuk saat ini saya menunggu jadwal sidangnya Pak dikarenakan juga saya baru saja pada hari ini mengirimkan berkas pelengkapnya yaitu transkrip nilai final. Kemudian mohon maaf juga Pak, izin bertanya terkait form pergantian judul skripsi saya yang telah saya kirim sebelumnya, apakah sudah ditanda tangani Pak? Untuk berjaga - jaga jika diminta oleh pihak akademik Pak. Mohon maaf jika terdapat salah kata serta mohon Pak karena baru mengabarkan terkait seminar hasilnya hari ini. Terima kasih Pak .",1,-1
1/7/21,dosen,Wa'alaikumsalam.. ok,1,-1
1/7/21,mahasiswa,"Baik Pak, mohon maaf sebelumnya Pak, izin bertanya kembali dan konfirmasi, untuk form pergantian judulnya apakah saya perlu mengirimkannya kembali Pak?",1,-1
1/8/21,mahasiswa,"Assalamualaikum Wr. Wb. Selamat siang Pak [DOSEN] . Mohon maaf mengganggu waktu Bapak. Saya [MHS] mahasiswa bimbingan skripsi Bapak. Sebelumnya mohon maaf Pak, izin memberikan informasi bahwa pada tanggal 11 Januari 2021, alhamdulillah saya telah dijadwalkan sidang skripsi yang dijadwalkan pada pukul 09.15 hingga 10.30 sesuai dengan yang ada di FilkomApps dengan dosen pengujinya Pak [DOSEN] sebagai dosen penguji I dan Pak [DOSEN] sebagai dosen penguji II. Sebelumnya mohon maaf juga Pak, izin bertanya dan melakukan konfirmasi terkait sidang nanti, apakah Bapak dapat menghadiri sidang skripsi saya pada hari senin nanti Pak? Mohon maaf jika terdapat salah kata Pak . Terima kasih banyak Pak.",1,1
1/8/21,dosen,Wa'alaikumsalam.. ok,1,1
1/8/21,dosen,<DOC>,1,1
1/8/21,mahasiswa,"Baik Pak, Terima kasih banyak Pak .",1,1
1/11/21,mahasiswa,"Assalamualaikum Wr. Wb. Selamat pagi Pak [DOSEN] . Mohon maaf mengganggu waktu Bapak. Saya [MHS] mahasiswa bimbingan skripsi Bapak. Sebelumnya mohon maaf Pak, izin memberikan informasi bahwa dari Pak [DOSEN] sebagai dosen penguji pertama telah membuat link google meet untuk sidang saya nanti pada pukul 09.15 - 10.30. Berikut saya lampirkan link google meetnya Pak. meet.google.com/cso-bafb-fgq Mohon maaf jika terdapat salah kata Pak. Terima kasih banyak Pak [DOSEN].",1,-1
1/11/21,mahasiswa,Assalamualaikum Wr. Wb. Selamat pagi Pak [DOSEN]. Mohon maaf mengganggu waktu Bapak. Sebelumnya mohon maaf Pak. Izin mengingatkan kembali bahwa pada hari ini terdapat sidang dari skripsi saya Pak. Mohon maaf jika terdapat salah kata. Terima kasih banyak Pak [DOSEN].,-1,-1
1/13/21,dosen,"*Pengumuman Akademik Status Mahasiswa Skripsi* Terkait status keaktifan dari mahasiswa FILKOM pada semester Genap 2020/2021, Fakultas Ilmu Komputer mengambil kebijakan sbb: 1. Bagi mahasiswa Filkom yang telah mendaftar Semhas dan Sidang Skripsi per tanggal 8 Januari 2021, maka Status Akademik akan diset BLOKIR pada Semester Genap 2020/2021 sehingga tidak perlu melakukan daftar ulang dan pembayaran SPP/UKT. 2. Jika mahasiswa dapat menyelesaikan Sidang Skripsi dan Pendaftaran Yudisium paling lambat tanggal *5 Februari 2021* maka Status akan dirubah menjadi Lulus Semester Ganjil 2020/2021. 3. Jika mahasiswa tidak dapat menyelesaikan pendaftaran Yudisium sampai dengan tanggal *5 Februari 2021* tersebut maka mahasiswa harus melakukan Daftar Ulang Semester Genap 2020/2021 dan membayar UKT/SPP. _an. Dekan Filkom_ _Wakil Dekan Bidang Akademik_",1,1
1/13/21,mahasiswa,"Baik Pak [DOSEN], terima kasih banyak atas informasinya Pak🙏",1,1
1/21/21,mahasiswa,"Assalamualaikum Wr. Wb. Selamat pagi Pak [DOSEN]. Mohon maaf mengganggu waktu Bapak. Saya [MHS] mahasiswa bimbingan skripsi Bapak dari angkatan 2017. Mohon maaf sebelumnya Pak, izin memberikan informasi bahwa saya telah melakukan revisi penulisan skripsi berdasarkan revisi dari Pak Putra dan Pak Ridok. Berikut saya lampirkan skripsi saya Pak.",1,1
1/21/21,mahasiswa,<DOC>,1,1
1/21/21,mahasiswa,Apakah terdapat saran atau revisi terkait skripsi saya Pak? Mohon maaf jika terdapat salah kata Pak. Terima kasih Pak . Mohon maaf juga mengganggu waktunya.,1,1
1/21/21,dosen,Hal awal thn 2021,1,1
1/21/21,dosen,Pernyataan juga sesuaikan tgl ujian,1,1
1/21/21,dosen,"Penulisan gelar singkatan., spasi. Contoh Nama, M. SC., Ph.D., selalu Ketua Jurusan",1,1
1/21/21,dosen,Itu diakhiri titik. Setelah titik kan huruf besar. Karena ada lanjutannya tambah koma,1,1
1/21/21,dosen,"Itu saja, biasanya yg dibaca awal itu.",1,1
1/21/21,mahasiswa,"Baik Pak , saya revisi kembali terkait penulisan sesuai saran dari Bapak. Terima kasih banyak Pak [DOSEN]  atas masukannya🙏.",1,1